{
  "schema": 1,
  "id": "silero-vad-v5",
  "name": "Silero VAD v5",
  "task": "vad",
  "mode": "live",
  "runtime": "onnx/silero-vad",
  "langs": [
    "*"
  ],
  "license": "MIT",
  "attribution": "snakers4/silero-vad",
  "redistributable": true,
  "size_bytes": 2327524,
  "description": "Default voice activity detector. Most accurate backend measured (F1 0.940) and permissively licensed. See docs/adr/0001-vad-backend-licensing.md.",
  "profile": {
    "rss_mb": {
      "idle": 12,
      "peak": 30
    },
    "min_ram_mb": 128,
    "rtf": {
      "cpu_x86_avx512vnni_8t": 0.0063
    },
    "latency_ms": {
      "first_partial": 17,
      "finalize_p50": 91,
      "finalize_p95": 982
    },
    "quality": {
      "f1_ten_testset": 0.94,
      "precision_ten_testset": 0.925,
      "recall_ten_testset": 0.956
    },
    "accel": [
      "cpu",
      "coreml",
      "cuda"
    ]
  },
  "files": [
    {
      "name": "silero_vad.onnx",
      "sha256": "1a153a22f4509e292a94e67d6f9b85e8deb25b4988682b7e174c65279d8788e3",
      "size": 2327524,
      "url": "https://github.com/snakers4/silero-vad/raw/master/src/silero_vad/data/silero_vad.onnx",
      "mirror": [
        "https://github.com/Techainer/summo-models/releases/download/silero-vad-v5-v1/silero_vad.onnx"
      ]
    }
  ],
  "params": {
    "model": "silero_vad.onnx",
    "threshold": 0.5,
    "frame_len": 512,
    "context_len": 64
  }
}
